[
  {
    "schema_version": "1.0.0",
    "tenant_id": "default",
    "agent_run_id": "a1b2c3d4-0001-4a1a-8b2b-000000000001",
    "decision_edge_id": "a1b2c3d4-0004-4a1a-8b2b-000000000030",
    "trace_id": "0af7651916cd43dd8448eb211c80319c",
    "source_type": "mcp_invocation",
    "source_id": "a1b2c3d4-0002-4a1a-8b2b-000000000012",
    "target_type": "memory_operation",
    "target_id": "a1b2c3d4-0003-4a1a-8b2b-000000000020",
    "relation": "triggered",
    "weight": 0.9,
    "step_index": 3
  },
  {
    "schema_version": "1.0.0",
    "tenant_id": "default",
    "agent_run_id": "a1b2c3d4-0001-4a1a-8b2b-000000000001",
    "decision_edge_id": "a1b2c3d4-0004-4a1a-8b2b-000000000031",
    "trace_id": "0af7651916cd43dd8448eb211c80319c",
    "source_type": "memory_operation",
    "source_id": "a1b2c3d4-0003-4a1a-8b2b-000000000020",
    "target_type": "llm_call",
    "target_id": "3333333333330001",
    "relation": "influenced",
    "weight": 0.95,
    "step_index": 4
  },
  {
    "schema_version": "1.0.0",
    "tenant_id": "default",
    "agent_run_id": "a1b2c3d4-0001-4a1a-8b2b-000000000001",
    "decision_edge_id": "a1b2c3d4-0004-4a1a-8b2b-000000000032",
    "trace_id": "0af7651916cd43dd8448eb211c80319c",
    "source_type": "llm_call",
    "source_id": "3333333333330001",
    "target_type": "final_answer",
    "target_id": "a1b2c3d4-0001-4a1a-8b2b-000000000001",
    "relation": "caused",
    "weight": 1.0,
    "step_index": 5
  }
]
